Unnamed: 0,id,uuid,name_zh,name_en,unit,sampling_start,sampling_end,valid_time,location,class_code,description,source_description,source_original_id,source_url,classification_system,source,source_type,completeness_type,first_class,second_class,third_class,data_entry_by,location_id,synonyms,data_version,create_time,class_id
160,1819170653081833472,4efbd731-fe40-4dc4-9e32-fa3adb4f6141,POLOKAL 3S Pro 管道系统（DN7538 毫米）、POLOKAL 3S Pro 管道系统（DN11048 毫米）、POLOKAL 3S Pro 管道系统（DN12553 毫米）、POLOKAL 3S Pro 管道系统（DN16049 毫米）,"POLOKAL 3S Pro Pipe System (DN7538mm), POLOKAL 3S Pro Pipe System (DN11048mm), POLOKAL 3S Pro Pipe System (DN12553mm), POLOKAL 3S Pro Pipe System (DN16049mm)",kg,2024-01-30,2024-01-30,2029-01-30,"None

The provided text does not specify any geographical scope for the product",,"Description: The POLO-KAL 3S Pro pipe system is designed as a highly sound-insulating multi-layer push-in socket pipe system for optimized transmission room values. The ranges are divided into the following dimensions according to the outside diameter of the pipe (mm): DN75, DN110, DN125 and DN160. The wall thickness in mm/dimension: DN75 3.8mm; DN110 4.8mm; DN125 5.3mm; DN160 4.9mm. It is specially designed for use as a highly sound-insulating house drain pipe system. Suitable for construction class B (SWE). Transmitting space value of 45 dB(A) Q= 2l/s with 14 dB(A) according to DIN 4109. The materials used for this pipe system are polypropylene, mineral fillers, thermoplastic elastomers and synthetic elastomers and is produced based on EN 1451-1.",The International EPD® System,,https://www.environdec.com/library/epd12201,,EPD,3,4,,,,吴宇森,,,,2024-08-01 17:37:36.908413,
161,1819170721532874752,c23d69ca-4671-4cdf-946e-9ebb12ac7814,Masterdenz Eco（100 毫米）,Masterdenz Eco(100mm),L,,,,,,,The International EPD® System,,https://www.environdec.com/library/epd12360,,EPD,3,4,,,,吴宇森,,,,2024-08-01 17:37:53.227999,
162,1819170879637164032,b456b589-7626-4bc6-a4f5-fe735b5ee99a,索普莱彻 Sl 500,SOPRATORCH SL 500,kg,2024-07-11,2024-07-11,2029-07-11,Worldwide,,"Description: The SOPREMA Group has been developing and diversifying its activities, worldwide, by including, over the years, additional operations to its traditional trade, waterproofing. By becoming the world leader in waterproofing solutions, the group is today a key player in the construction sector. SOPREMA was created in 1908 as an independent family group and now operates globally with 101 manufacturing plants, more than 100 subsidiaries, and over 4,000 distributors. The product, SOPRATORCH SL 500, is a membrane composed of elastomer modified bitumen and a non-woven polyester reinforcement. It is used as an upper layer within a single or multi-layer waterproofing system. The upper surface is finished with slates and the overlap is protected by a thermofusible film. The lower surface is also protected by a thermofusible film. The membrane has a reference service life of 70 years.",The International EPD® System,,https://www.environdec.com/library/epd13730,,EPD,3,4,,,,吴宇森,,,,2024-08-01 17:38:30.923336,
163,1819171047115722752,21aecc06-65b2-4e25-80d7-1463ee7813bb,通风玻璃 PB 3 TF,VENTIGLASS PB 3 TF,kg,2024-07-11,2024-07-11,2029-07-11,Worldwide,,"Description: The SOPREMA Group has been developing and diversifying its activities, worldwide, by including, over the years, additional operations to its traditional trade, waterproofing. By becoming the world leader in waterproofing solutions, the group is today a key player in the construction sector. SOPREMA was created in 1908 as an independent family group and now operates globally with 101 manufacturing plants, more than 100 subsidiaries, and over 4,000 distributors. The product, VENTIGLASS PB 3 TF, is a membrane with a vapor-pressure and tension dispersion system, composed of polymer bitumen and a fiberglass reinforcement. It is used as a base layer within a multi-layer waterproofing system on surfaces where partial adhesion is required. The upper surface is finished with talcum/sand, and the lower surface is provided with thermofusible bitumen stripes alternated with non-stick stripes protected by a thermofusible film. The membrane has a reference service life of 70 years when combined with a Soprema top layer.",The International EPD® System,,https://www.environdec.com/library/epd13494,,EPD,3,4,,,,吴宇森,,,,2024-08-01 17:39:10.853817,
164,1819171339907502080,9b33c8ab-d07d-4ce5-be3d-527ed94965f0,SOPRAROCK YEP 3600,SOPRAROCK YEP 3600,Not,2024-07-11,2024-07-11,2029-07-11,Worldwide,,"Description: The SOPRAROCK YEP 3600 is a membrane composed of elastomer modified bitumen and a composite polyester reinforcement. It is utilized as a base layer within a multi-layer waterproofing system. The upper surface is protected by a thermofusible film, while the lower surface is finished with talcum/sand. The membrane has a reference service life of 70 years when combined with a Soprema top layer.",The International EPD® System,,https://www.environdec.com/library/epd13737,,EPD,3,4,,,,吴宇森,,,,2024-08-01 17:40:20.660895,
165,1819171519864115200,38c798f1-84a5-41f7-b81e-f9c5bbe16d58,SOPRALENE MF 5500,SOPRALENE MF 5500,kg,2024-07-11,2024-07-11,2029-07-11,Worldwide,,Description: The SOPRALENE MF 5500 is a membrane composed of elastomer modified bitumen with fire retardant additives and a composite polyester reinforcement. It is designed for use as an upper layer within a single or multi-layer waterproofing system where fire retardant properties are required. The upper surface is finished with slates and the overlap is protected by a thermofusible film. The lower surface is also protected by a thermofusible film. The membrane has a reference service life of 70 years.,The International EPD® System,,https://www.environdec.com/library/epd13722,,EPD,3,4,,,,吴宇森,,,,2024-08-01 17:41:03.565750,
166,1819171667180654592,0217de8b-9e91-4870-a26e-be6862c011d5,SOPRAROCK GLOBAL SBS 30 TF,SOPRAROCK GLOBAL SBS 30 TF,kg,2024-07-11,2024-07-11,2029-07-11,"None

However",,"Description: The SOPRAROCK GLOBAL SBS 30 TF is a membrane composed of elastomer modified bitumen and a composite polyester reinforcement. It is used as a base layer within a multi-layer waterproofing system. The upper surface is finished with talcum/sand, while the lower surface is protected by a thermofusible film. The membrane has a reference service life of 70 years when combined with a Soprema top layer. Energy consumption and used ancillary materials during installation are considered and are based on the average installation scenario of the product, which includes 10% overlapping material.",The International EPD® System,,https://www.environdec.com/library/epd13745,,EPD,3,4,,,,吴宇森,,,,2024-08-01 17:41:38.688916,
167,1819171744573952000,540dfa3b-e9f3-4846-b33c-456a8d4cbc54,无机颜料 (NACE 2030)、无机颜料 (CPA 203021)、无机颜料 (20302130)、无机颜料 (UN CPC 3511),"Inorganic Pigments (NACE 2030), Inorganic Pigments (CPA 203021), Inorganic Pigments (20302130), Inorganic Pigments (UN CPC 3511)",kg,2024-07-19,2024-07-19,2029-07-11,,,"Description: The inorganic pigments are chemical substances manufactured by an industrial process involving a chemical reaction in a solid state. In this process, a mixture of raw materials (oxides and metal salts) undergoes a calcination reaction at high temperatures, forming a specific crystalline matrix. The chemical composition of inorganic pigments is usually expressed as a combination of metal oxides, although these oxides are only used as raw materials, since they are not present once the inorganic pigment has been manufactured. During the calcination process, the raw materials are completely consumed. The resulting inorganic pigment forms a stable crystalline structure. The stability of their crystalline structure determines the intrinsic properties and behavior of inorganic pigments. In general, inorganic pigments are not very soluble and have very low reactivity. These substances are used in high-temperature applications due to their extreme durability, which offers light fastness and weather stability. Pigments are usually in powder form and are marketed with a defined grain size distribution depending on the decorative effects to be achieved. The uses and applications for which inorganic pigments are intended cover a wide range, from ceramic use (the most common) to more specific uses focused on industrial sectors such as flat and/or hollow glass decoration, tableware, construction, automotive, plastics, galvanizing/glazing of metal surfaces, and traditional and artistic ceramics.",The International EPD® System,,https://www.environdec.com/library/epd15446,,EPD,3,4,,,,吴宇森,,,,2024-08-01 17:41:57.140293,
168,1819171830309720064,28f18d0a-b864-4397-815f-61c085b3123a,数码喷墨墨水（CPA 203021，UN CPC 3511）,"Digital Inkjet Inks (CPA 203021, UN CPC 3511)",kg,2024-07-19,2024-07-19,2029-07-11,,,"Description: The digital inkjet inks are generally defined as a suspension composed mainly of a liquid part (solvent mixture), a solid part (pigment or inorganic matter) and a dispersing component. In baking decoration processes, inkjet inks undergo a chemical transformation in which the solvent mixture is burned off, leaving the pigment permanently fixed on the surface to which it is applied. This process gives the ink remarkable high temperature resistance and long-term durability. The uses and applications for which digital inkjet inks are intended cover a wide range, from ceramic use (the most common) to more specific uses focused on industrial sectors such as flat and/or hollow glass decoration, textiles, tableware, automotive, construction, paper, wood, galvanized/glazed metal surfaces, and traditional and artistic ceramics. Digital inkjet inks for the ceramic industry represent one of the most important innovations in this industrial sector. They are specifically formulated for application with digital ceramic printers. Unlike traditional methods, they are printed directly on the ceramic through an inkjet printing process (dispersed through thermal or piezoelectric injectors), which allows the reproduction of high-resolution images.",The International EPD® System,,https://www.environdec.com/library/epd15447,,EPD,3,4,,,,吴宇森,,,,2024-08-01 17:42:17.581110,
169,1819171981153669120,e8c1298b-eba1-4f7b-8f04-246ad05632bf,SOPRALENE GLOBAL C3 48 GF (Soprema),SOPRALENE GLOBAL C3 48 GF(Soprema),kg,2024-07-11,2024-07-11,2029-07-11,Worldwide,,Description: The SOPRALENE GLOBAL C3 48 GF is a membrane composed of elastomer modified bitumen with fire retardant additives and a composite polyester reinforcement. It is designed for use as an upper layer within a multi-layer waterproofing system where fire retardant properties are required. The upper surface is finished with granules and the overlap is protected by a thermofusible film. The lower surface is also protected by a thermofusible film. The membrane has a reference service life of 70 years.,The International EPD® System,,https://www.environdec.com/library/epd13744,,EPD,3,4,,,,吴宇森,,,,2024-08-01 17:42:53.545221,
170,1819172120362618880,c67d2c9b-ddaf-4f57-a8fd-77e9b6090442,泰克诺尔 288100 白色（泰克诺尔 2881）,TEKNOL 288100 WHITE (TEKNOL 2881),kg,2024-06-18,2024-06-18,2029-06-18,Europe,,"Description: TEKNOL 2881-00 is a water-borne primer based on alkyd and acrylic. It is used for industrial priming of wooden facade boards and prefabricated units for wooden houses. This product protects the wood until it is top coated at the building site or in the factory, with the top coating recommended to be done as soon as possible, ideally by the next summer. It can be top coated with both dispersion and oil paints. Apply at temperatures between 15°C and 40°C, and humidity levels below 80% RH. The surface temperature must be at least 3°C above the dew point to prevent moisture condensation during the curing process. The surface to be coated must be clean, dry, and free from dust and grease.",The International EPD® System,,https://www.environdec.com/library/epd14559,,EPD,3,4,,,,吴宇森,,,,2024-08-01 17:43:26.735649,
171,1819172292542992384,5503af3f-4a22-4db7-a3e7-350d325b9cb7,sopralene optima garden 4 gf c3 fr,SOPRALENE OPTIMA GARDEN 4 GF C3 FR,kg,2024-07-11,2024-07-11,2029-07-11,Worldwide,,Description: This is a membrane composed of elastomer modified bitumen with root-repellent and fire retardant additives and a composite polyester reinforcement. It is used as an upper layer within a single or multi-layer waterproofing system for green roofs where fire retardant properties are required. It is also used as a waterproofing layer for basement tanking and underground structures and acts as a radon barrier. The upper surface is finished with granules and the overlap is protected by a thermofusible film. The lower surface is protected by a thermofusible film. The membrane has a reference service life of 70 years.,The International EPD® System,,https://www.environdec.com/library/epd13746,,EPD,3,4,,,,吴宇森,,,,2024-08-01 17:44:07.786609,
172,1819172427125624832,0f5f4f9a-c138-471d-89b1-ab2afb7996cd,阿尔法净水器（宽度 15 米 / 长度 50 米）(GTIN 5712649000048)，阿尔法净水器（宽度 30 米 / 长度 50 米）(GTIN 5712649416030)，阿尔法净水器（宽度 20 米 / 长度 25 米）(GTIN 5712649413787)，阿尔法净水器（宽度 05 米 / 长度 25 米）(GTIN 5712649413800)，阿尔法净水器（宽度 05 米 / 长度 25 米）(GTIN 5712649413794),"alpha neti dampspærre (width 15 m /length 50 m)(GTIN 5712649000048), alpha neti dampspærre (width 30 m /length 50 m)(GTIN 5712649416030), alpha neti dampspærre (width 20 m /length 25 m)(GTIN 5712649413787), alpha neti remfoil (width 05 m /length 25 m)(GTIN 5712649413800), alpha neti remfoil (width 05 m /length 25 m)(GTIN 5712649413794)",m²,2024-07-18,2024-07-18,2029-07-18,Europe,,"Description: alpha neti dampspærre consists of a grid-reinforced film and a non-woven polypropylene fabric. With airtight bonding of all membrane overlaps and connections to adjacent building components, it enables a reduction in heat loss from buildings, prevents structural damage, and supports a comfortable indoor climate in winter as well as in summer.",The International EPD® System,,https://www.environdec.com/library/epd12263,,EPD,3,4,,,,吴宇森,,,,2024-08-01 17:44:39.873190,
173,1819172582151294976,8070d50a-cb1a-42f3-9dbb-bbebb645ed7e,sopralene optima 4 af c3 fr,SOPRALENE OPTIMA 4 AF C3 FR,kg,2024-07-11,2024-07-11,2029-07-11,Worldwide,,Description: The SOPRALENE OPTIMA 4 AF C3 FR is a membrane composed of elastomer modified bitumen with fire retardant additives and a composite polyester reinforcement. It is designed for use as an upper layer within a single or multi-layer waterproofing system where fire retardant properties are required. The upper surface is finished with slates and the overlap is protected by a thermofusible film. The lower surface is also protected by a thermofusible film. The membrane has a reference service life of 70 years.,The International EPD® System,,https://www.environdec.com/library/epd13747,,EPD,3,4,,,,吴宇森,,,,2024-08-01 17:45:16.834376,
174,1819172637054734336,af855570-a3da-4917-9d4e-79bab6772cde,液基釉料 (3511),Liquidbased Glazes (3511),kg,2024-07-19,2024-07-19,2029-07-11,,,"Description: The liquid-based glazes are typically prepared as an aqueous suspension applied onto a ceramic support, such as a tile made of clay material. After application, the glaze undergoes a firing process, resulting in a ceramic tile with the desired properties. The formulation includes a mix of frits, inorganic pigments, raw materials, semi-finished products, and additives. When fired, the mixture melts and, upon cooling, forms a compact, predominantly vitreous structure that is water-insoluble, physically resistant, and chemically resistant. The glaze also enhances the aesthetic and decorative qualities of the support. Liquid-based glazes, often referred to as slips, are produced through wet milling and must possess specific rheological properties for application. The water-to-solid ratio is determined by the intended use, and these glazes are supplied ready for application on ceramic supports or for further processing.",The International EPD® System,,https://www.environdec.com/library/epd15444,,EPD,3,4,,,,吴宇森,,,,2024-08-01 17:45:29.924018,
175,1819172751160774656,937480ef-b72b-4d37-bc4a-2632ff5916fb,Cânhamor ECOblock 12（大麻块）,Cânhamor ECOblock 12 (Hemp block),kg,2024-07-15,2024-07-15,2029-07-14,Portugal,,"Description: Prefabricated hemp blocks with 12 cm width for interior walls, roofs, floors, and insulation of existing interior and exterior walls. a With 8 mm adhesive mortar; b With 2 cm plaster.",The International EPD® System,,https://www.environdec.com/library/epd9475,,EPD,3,4,,,,吴宇森,,,,2024-08-01 17:45:57.129134,
176,1819172837269835776,328c09de-b975-4f78-9a9e-7e1919974f33,熔块（玻璃熔块）、熔块（预制颜料、不透明剂和预制色素）,"Frits (Glass Frit), Frits (Prepared Pigments, Opacifiers, and Prepared Colours)",kg,2024-07-19,2024-07-19,2029-07-11,,,"Description: Frits are vitreous inorganic substances, practically insoluble in water, which are obtained by melting, at high temperatures (>1500ºC), a mixture of raw materials which, in turn, can be of natural or synthetic origin. The molten mass is rapidly cooled with air or water, giving rise to a glassy mass called frit. Consequently, frits have a glassy structure, formed by structural units that do not repeat at regular distances. From the point of view of industrial processes for the manufacture of ceramic floor and wall tiles, frits are elaborated raw materials used to prepare engobes, glazes, and inks, providing a series of properties that improve the appearance and functionality of ceramic tiles. They provide properties such as wear resistance, impermeability, hardness, and the ability to create a decorative surface. The uses and applications for which frits are intended cover a wide range, from ceramic use (the most common) to more specific uses focused on industrial sectors such as the manufacture of flat and/or hollow glass, photovoltaic, medical, electronics, construction, automotive, galvanizing/glazing of metal surfaces, and traditional and artistic ceramics. The frits are supplied already mixed with the rest of the raw materials of the glazes and digital inkjet inks or as such in big bags.",The International EPD® System,,https://www.environdec.com/library/epd15440,,EPD,3,4,,,,吴宇森,,,,2024-08-01 17:46:17.659208,
177,1819173139452661760,164ddfa8-4d2b-4d81-b2be-b7f27105c8f5,阿尔法通用胶带，用于屋顶垫层、防潮层和防风层（GTIN 5712649413312，宽度 60 毫米/长度 25 米）,"alpha universal tape for roof underlay, vapour and wind barriers (GTIN 5712649413312, Width 60 mm / Length 25 m)",m²,2024-07-18,2024-07-18,2029-07-18,Europe,,"Description: Alpha universal tape is an adhesive tape specially developed for joining vapour barrier membranes, for airtight connections of all types of vapour barrier and airtight membranes, including roof underlays. It is designed for interior and exterior use for durable joints. The tape is flexible but not stretchy and can therefore be used for joints as well as for details in the waterproofing layer, for example, around rafters or joists. The tape can also be used on underlayments and wind barriers. It adheres strongly to polyethylene, polypropylene, wood, and aluminium sheets.",The International EPD® System,,https://www.environdec.com/library/epd12267,,EPD,3,4,,,,吴宇森,,,,2024-08-01 17:47:29.704980,
178,1819173389059887104,2893532d-3267-46bf-8171-12fd9fb1ead1,Cânhamor ECOblock 20（大麻块）,Cânhamor ECOblock 20 (Hemp block),kg,2024-07-15,2024-07-15,2029-07-14,Portugal,,"Description: Cânhamor is the first hemp block manufacturer in the Iberian Peninsula. Our mission is to revolutionize conventional materials and methods. We make hemp blocks from natural and sustainable materials that are significantly easier and faster to work with and provide an ecological, highly insulated and durable alternative. Our vision is to build with nature instead of exploiting it, creating a better future for ourselves and future generations.

Product description: Prefabricated hemp blocks with 20 cm width for exterior walls, dividing walls for apartments, offices and workshops, and exterior walls for residential dwellings. a With 8 mm adhesive mortar; b With 2 cm plaster.",The International EPD® System,,https://www.environdec.com/library/epd14158,,EPD,3,4,,,,吴宇森,,,,2024-08-01 17:48:29.216374,
179,1819173526352039936,607b5b08-bf58-4a84-bc2b-120f779c3b47,RAW 全年保鲜袋（580 毫升铝箔管），RAW 全年保鲜袋（300 毫升盒装）,"RAW AllYear folieklæber(580 ml foil tube), RAW AllYear folieklæber(300 ml cartridge)",kg,2024-07-18,2024-07-18,2029-07-18,Europe,,"Description: The RAW All-Year folieklæber is a 1-component dispersion adhesive based on acrylic acid copolymer and ethanol (15%). It is suitable for airtight connections of vapor control and air-sealing membranes of all types. Available in 580 ml foil tube or 300 ml cartridge formats. This adhesive has exceptionally high cohesion while remaining elastic, providing security and longevity to joints due to its outstanding adhesion to building materials. Made from age-resistant acrylic acid copolymer without plasticizers or halogenated compounds, it cannot become dry or brittle. Contains denatured alcohol (15%) allowing deep penetration into materials ensuring strong adhesion. Suitable for use all year round with processing temperatures down to -10°C. Free from plasticizers and halogens.",The International EPD® System,,https://www.environdec.com/library/epd12266,,EPD,3,4,,,,吴宇森,,,,2024-08-01 17:49:01.949066,
180,1819173862072520704,6c43a59b-3291-487d-88d1-a27122496081,反岩 5 TF C1,ANTIROCK 5 TF C1,kg,2024-07-11,2024-07-11,2029-07-11,Worldwide,,"Description: The SOPREMA Group has been developing and diversifying its activities, worldwide, by including, over the years, additional operations to its traditional trade, waterproofing. By becoming the world leader in waterproofing solutions, the group is today a key player in the construction sector. SOPREMA was created in 1908 as an independent family group and now operates globally with 101 manufacturing plants, more than 100 subsidiaries, and over 4,000 distributors. The product, ANTIROCK 5 TF C1, is a membrane composed of elastomer modified bitumen and a composite polyester reinforcement. It is used as a single-layer waterproofing system, underneath asphalt concrete or mastic asphalt, for civil works and car parks. The upper surface is finished with talcum/sand and the overlap is protected by a thermofusible film. The lower surface is also protected by a thermofusible film. The membrane has a reference service life of 70 YEARS.",The International EPD® System,,https://www.environdec.com/library/epd13742,,EPD,3,4,,,,吴宇森,,,,2024-08-01 17:50:21.991174,
181,1819173923951087616,e1d4206c-e6ca-4a2a-b799-13f7668eecf7,干基釉料（CPA 20302150）,Drybased Glazes (CPA 20302150),kg,2024-07-19,2024-07-19,2029-07-11,,,"Description: The glaze is typically prepared in the form of an aqueous suspension that is applied onto the support (the part of the tile made of clay material). Subsequently, it is subjected to a firing process that results in the ceramic tile with the desired final properties. Glaze formulations typically include a mixture of frits, inorganic pigments, raw materials, semi-finished products, and additives. This mixture is applied as a thin layer onto the ceramic support. Upon firing, it melts and upon cooling forms a compact mass with a predominantly vitreous structure, insoluble in water, physically resistant, and resistant to the chemical agents it will encounter during its use. Additionally, it adds aesthetic and decorative elements to the support on which it is applied. The dry-based glazes are the result of the dosing mainly of frits, pigments, raw materials, semi-finished products, and additives. The dosing of the different elements that constitute glazes will be determined by the final properties expected after their subsequent application and firing. These can be delivered to customers in solid form in big bags for on-site milling or sent to other processes for wet milling or micronizing.",The International EPD® System,,https://www.environdec.com/library/epd15443,,EPD,3,4,,,,吴宇森,,,,2024-08-01 17:50:36.743981,
182,1819174491180371968,1850baa9-1fd8-4776-87e3-662877491ea4,阿尔法泡沫（310 毫升/盒装），阿尔法泡沫（600 毫升/箔管）,"alpha folieklæber(310 ml / cartridge), alpha folieklæber(600 ml / foil tube)",kg,2024-07-18,2024-07-18,2029-07-18,Europe,,"Description: The alpha folieklæber is an aging-resistant acrylic copolymer that comes in a 600 ml foil tube or 310 ml cartridge packaging. It is a foil adhesive designed for creating airtight joints, enabling a permanent airtight connection between the vapor barrier and adjacent building elements like rear walls, decks, and rafters. Based on an aqueous dispersion of acrylic acid copolymers, it does not contain ethanol. The adhesive is suitable for various types of vapor barriers, including PE, PA, PP, and aluminum foils, and adheres well to both smooth and rough surfaces such as wood, plaster, masonry, and concrete. It provides a strong, permanent bond with high elasticity and is solvent-free.",The International EPD® System,,https://www.environdec.com/library/epd12265,,EPD,3,4,,,,吴宇森,,,,2024-08-01 17:52:51.982304,
