Unnamed: 0,id,uuid,name_zh,name_en,unit,sampling_start,sampling_end,valid_time,location,class_code,description,source_description,source_original_id,source_url,classification_system,source,source_type,completeness_type,first_class,second_class,third_class,data_entry_by,location_id,synonyms,data_version,create_time,class_id
0,1818422100348768256,16d2ddd3-38be-45c4-8256-d5ada9d42bc9,Tapiflex Excellence 17db、Tapiflex Excellence 19db、Tapiflex Platinium 100、Tapiflex Stairs、Ruby 70 Acoustic,"Tapiflex Excellence 17db, Tapiflex Excellence 19db, Tapiflex Platinium 100, Tapiflex Stairs, Ruby 70 Acoustic",m²,,,2029-07-09,Europe,,"Description: Tarkett's Tapiflex is a heterogeneous compact resilient floor covering. Developed with over 130 years of experience, Tarkett offers integrated flooring solutions tailored to meet the specific needs of customers. The product line includes various models such as Tapiflex Excellence 17db, Tapiflex Excellence 19db, Tapiflex Platinium 100, Tapiflex Stairs, and Ruby 70 Acoustic. The recommended service lifetime for these floor coverings is 25 years. The company emphasizes sustainability and environmental responsibility, incorporating Cradle-to-Cradle principles into its design and production processes. Tarkett is committed to creating eco-friendly products and operates with a focus on the lifecycle analysis of its products, from production through disposal and recycling.",The International EPD® System,,https://www.environdec.com/library/epd1347,,EPD,3,4,,,,吴宇森,,,,2024-07-30 16:03:08.028961,
1,1818422650695979008,ea0fc40b-6b12-47dd-8bda-306daf32c39b,Acczent Platinium 100,Acczent Platinium 100,m²,2024-07-09,2024-07-09,2029-07-09,Europe,,Description: Acczent Platinium 100 is a heterogeneous compact resilient floor covering developed by Tarkett. The service lifetime recommended by Tarkett is 25 years.,The International EPD® System,,https://www.environdec.com/library/epd14478,,EPD,3,4,,,,吴宇森,,,,2024-07-30 16:05:19.242002,
2,1818423001021026304,1d186ee8-f34c-4215-94d6-7a5180ca730b,聚乙烯类木质泡沫板（G86）、,"Polyethylene WoodLike Foam Board (G86),",tonne,2024-07-24,2024-07-24,2029-07-23,China,,"Description: The product is made of marine plastic waste, household waste plastics, and other recycled plastics as the main raw materials. The core layer adopts microcellular foaming technology with a variety of recycled polyolefin mixing systems, while the outer surface layer is made of modified HDPE as the primary material. These components are integrated through co-extruding technology, resulting in a product that exhibits surface aging-resistance, anti-bacterial, anti-mold properties, and high bonding strength. The surface of the product uses original imitation wood color mixing technology and surface wood texture processing, creating a high simulation of natural wood texture. It is primarily utilized in construction, furniture, packaging, and art, featuring a stable structure, lightweight yet high strength, strong nail holding power, and suitability for various handmade art processes and carving. The main material, HDPE recycled plastic, ensures durability of not less than 25 years and allows for 100% secondary use after the product's lifecycle ends. The product's density is 0.80 g/cm³.",The International EPD® System,,https://www.environdec.com/library/epd15629,,EPD,3,4,,,,吴宇森,,,,2024-07-30 16:06:42.766234,
3,1818423648596398080,0a83bb0f-f183-4d12-9216-23631aeccd54,陶瓷砖（1 级）、陶瓷砖（2 级）、陶瓷砖（3 级）、陶瓷砖（4 级）、陶瓷砖（5 级）,"Ceramic Tile (Class1), Ceramic Tile (Class2), Ceramic Tile (Class3), Ceramic Tile (Class4), Ceramic Tile (Class5)",kg,,,,,,"Description: Ceramic tiles are primarily made of kaolin, clay, and feldspar, but they also include other raw materials such as marble, frit, dolomite, bentonite, and quartz. The production technology of tiles is dry pressing. The required composition is blended with water to form a uniform slurry. This slurry is then fed into spray driers to form uniform granules ready for compaction. These granules are then shaped to form the bisque or green body. This can be glazed or left unglazed depending on its intended use. The green ceramic body is fired at high temperatures, resulting in a hard body. Ceramic floor tiles are largely used as interior and exterior floor coverings. Interior applications include bathrooms, kitchens, living rooms, halls, balconies, etc. Exterior applications can be in public buildings, commercial and industrial areas, swimming pools, and façades, etc. For interior applications, floor tiles should be selected regarding the technical specifications such as PEI value, hardness, stain resistance, chemical resistance, and easy cleaning, if they are to be used in the interiors of a residence. The tiles selected for exteriors should be frost-resistant and have low water absorbency. The numbers beside ceramic floor tiles indicate the abrasion resistance of the ceramic surface according to Turkish and European Standard TS-EN ISO 10545-7: Class-1: Suitable for walls and bedroom and bathroom floors. Class-2: Suitable for light traffic areas, such as the floors of a house. Class-3: Suitable for moderately heavy traffic floors such as in entrances and corridors. Class-4: Suitable for heavy traffic area floors such as in restaurants, stores, etc. Class-5: Suitable for floors subject to heavy foot traffic and abrasion, such as in shops, hotels, restaurants, offices, schools, exhibition halls, etc.",The International EPD® System,,https://www.environdec.com/library/epd872,,EPD,3,4,,,,吴宇森,,,,2024-07-30 16:09:17.160329,
4,1818424002683736064,574b98cd-7f21-4647-addb-fedaf0c25031,"Kalesinterflex(G86), Kalesinterflex(G33)","Kalesinterflex(G86), Kalesinterflex(G33)",kg,,,,,,"Description: Kalesinterflex® is a porcelain ceramic slab that comes in two options; with and without fibreglass backing. Primarily composed of clay, kaolin, and feldspar, it also includes other raw materials. The production process involves dry pressing, where the required composition is blended with water to form slurry, which is then dried to create uniform granules for compaction. These granules are shaped into a green body, which can be glazed before being fired at high temperatures to produce a hard body. Kalesinterflex® offers glazed and polished surface finishes and can be used as is or with fibreglass backing, depending on the application. It can be cut into various sizes to meet project requirements, including 1000x3000mm, 1000x1000mm, 500x3000mm, 500x1500mm, 500x1000mm, 500x500mm, 200x1500mm, and 50x1000mm. Suitable for both interior and exterior applications, such as facades, countertops, splash-backs, cladding, wet areas, and light commercial floors and walls, Kalesinterflex® can be installed on various surfaces like fibre cement sheets, concrete, brick, plaster, and waterproofing membranes. It can also be installed on facades using either a bonded or mechanical system, including a hidden clip system.",The International EPD® System,,https://www.environdec.com/library/epd1128,,EPD,3,4,,,,吴宇森,,,,2024-07-30 16:10:41.581475,
5,1818424194057244672,59e33e07-e33e-4f13-bb45-399efd3e53b2,阳光木（木塑）、,"Sunshine Wood(WPC),",tonne,2024-07-24,2024-07-24,2029-07-23,China,,"Description: The product is a kind of wood plastic composite product (WPC), made from recycled plastics, and waste plant fibres (waste wood flour, bamboo flour, agricultural and forestry straw fibre powder, etc.) as the main raw materials, with the amount used being more than 80% of the total raw materials. The product features an aging-resistant surface, anti-bacterial and anti-mold properties, and can achieve superior flame retardancy. As green and healthy building materials, they are widely used in outdoor courtyards, outdoor landscape flooring, fences, gazebos, wall panels, and more. The products utilize original color mixing and surface treatment technology, providing a high simulation of natural wood-like colors and a matte effect. Through the innovation of interface compatibility technology between polymers and plant fibers, the product achieves enhanced mechanical load-bearing performance. The surface of the product is maintenance-free and has a durability of not less than 25 years. At the end of its lifecycle, or when dismantled and replaced, the materials can be recycled and crushed for 100% secondary use. The density of the product is 1.22 g/cm³.",The International EPD® System,,https://www.environdec.com/library/epd12997,,EPD,3,4,,,,吴宇森,,,,2024-07-30 16:11:27.207837,
6,1818424409006936064,45c27937-acfe-43ee-874c-007cdb8b3fff,"Kaleseramik 墙砖（品种）, Kaleseramik 墙砖（品种）","Kaleseramik Wall Tiles (Variety), Kaleseramik Wall Tiles (Variety)",kg,,,,,,"Description: Kaleseramik produces 2200 varieties of wall tiles in 60 different dimensions. Kaleseramik Wall tiles are primarily made of kaolin and clay, but they also include other raw materials such as marble, frit, dolomite, bentonite and quartz. The production technology of tiles is dry pressing. The required composition is blended with water to form uniform slurry. This slurry is then fed into spray driers to form uniform granules ready for compaction. These granules are then shaped to form the bisque or green body. This can be glazed or left unglazed depending on its intended use. The green ceramic body is fired at high temperatures, resulting in a hard body. Kaleseramik Wall Tiles are largely used as interior and exterior wall coverings. Interior applications are mainly in bathrooms and kitchens in residential applications while the exterior applications can include swimming pools, façades, commercial and industrial applications etc. For interior applications, ceramic wall tiles should be selected regarding the technical specifications such as PEI value, hardness, stain resistance, chemical resistance and easy cleaning, if they are to be used in the interiors of a residence. The tiles selected for exteriors should be frost resistant and have low water absorbency. For outdoor uses they normally have less than 3% water absorption but for internal applications this might rise to 16%. Depending on the use, ceramic tiles might be glazed to control abrasion and slip resistance.",The International EPD® System,,https://www.environdec.com/library/epd873,,EPD,3,4,,,,吴宇森,,,,2024-07-30 16:12:18.456617,
7,1818424524111220736,0e73ceda-788e-4109-bab8-09eb1011abec,钻石系列 (392),Diamond Series (392),tonne,2024-07-24,2024-07-24,2029-07-23,China,,"Description: The product is a kind of aluminum plastic product, consisting of aluminum alloy profile as the main ""core layer"" material, modified HDPE as the main ""exterior cladding layer"" material, and through the modification technology of the functional surface layer and the development of special adhesives, it achieves the plastic-clad metal profile with high weather resistance, high strength, and high adhesion. The product is a polymer material cladding on the surface of aluminum alloy, which not only achieves superior thermal insulation effect but also solves the bottleneck of aluminum alloy in the door and window filling thermal insulation, or the need for partition processing, etc., and also greatly enhances the service life of aluminum alloy, and its product life can reach more than 25 years. The outer surface layer of the product is the independently developed high weather-resistant functional polymer wood-like material layer, which breaks through from the field of wood-plastic to the field of metal materials, and makes the application end of the material technology break through the limitations of the wood-plastic single industry. The density of the product is 2.00 g/cm³.",The International EPD® System,,https://www.environdec.com/library/epd15630,,EPD,3,4,,,,吴宇森,,,,2024-07-30 16:12:45.899550,
8,1818424887006597120,4b3d7150-e147-41d8-b873-b8ef383993d3,Kaleseramik 瓷砖（上釉）、Kaleseramik 瓷砖（无釉）,"Kaleseramik Porcelain Tiles(Glazed), Kaleseramik Porcelain Tiles(NonGlazed)",kg,,,,,,"Description: Kaleseramik Porcelain Tiles are primarily made of clay, kaolin, and feldspar, along with other raw materials. They are produced using dry pressing technology. The required composition is blended with water to form slurry, which is then fed into spray driers to create uniform granules for compaction. These granules are shaped into a green body that may be glazed if needed. The green ceramic body is fired at high temperatures to produce a hard body. The Kale porcelain tiles come in glazed and non-glazed options with surfaces that are non-glazed matt, glossy, or anti-slip. They are available in various dimensions including 20x20cm, 30x30cm, 40x40cm, 30x60cm, 60x60cm, and 60x120cm. These tiles offer superior technical characteristics, colors, and patterns to meet the requirements of different projects. They are suitable for use in interiors, exterior façades, pools, public places, commercial buildings, and more, including floors, walls, and exterior facades of residential, public, educational, and cultural buildings, as well as outdoor facilities like gardens, terraces, pool sides, and recreation areas.",The International EPD® System,,https://www.environdec.com/library/epd874,,EPD,3,4,,,,吴宇森,,,,2024-07-30 16:14:12.420917,
9,1818425348338094080,a3340f82-f8e0-4b95-a9b2-ef9ebc79d598,搪瓷卫生洁具（GCVC）、细火泥卫生洁具（GCFFC）,"Vitreous China Sanitaryware(GCVC), Fine Fireclay Sanitaryware(GCFFC)",kg,,,,,,"Description: Sanitaryware is the generic term used to describe items which traditionally were made from pottery, such as WC’s, washbasins, and bidets installed within a bathroom or washroom. Vitreous China (VC) is a common material used for bathroom sanitaryware, such as console sinks and toilets. Vitreous China sanitaryware products are primarily made of clay, kaolin, feldspar, and quartz but they may also include small quantities of other raw materials. Its high gloss, stain-resistant surface is ideal for use in both bathrooms and kitchens. The casting slip made of these raw materials is prepared and cast into plaster molds to form a green body. The green body then undergoes a natural drying process and is given a smooth finish. Glazing is applied before firing at 1200°C to obtain Vitreous China sanitaryware with almost no water absorption. Fine Fireclay (FFC) sanitaryware involves the preparation of a casting slip from pre-fired or calcined clay, clay, kaolin, and other minor raw materials. The slip is cast into plaster molds to form a green body, which then undergoes natural drying and smoothing before glazing and firing at 1220°C to obtain fireclay sanitaryware with water absorption less than 0.5% of the dry weight. Areas of use include main pieces like WCs and basins, larger bathroom pieces like shower trays and bathtubs, and other pieces like bidets and pedestals.",The International EPD® System,,https://www.environdec.com/library/epd875,,EPD,3,4,,,,吴宇森,,,,2024-07-30 16:16:02.410147,
10,1818425837586878464,9f7c830d-84c3-4654-89c7-9f4d223089fe,经典 40、黄玉 70、红宝石 70、流星 70、Acczent Excellence 80、Acczent Essential 70、Aqua Multisafe,"Classic 40, Topaz 70, Ruby 70, Meteor 70, Acczent Excellence 80, Acczent Essential 70, Aqua Multisafe",m²,,,2029-07-09,Europe,,"Description: The product is a heterogeneous compact resilient floor covering developed by Tarkett, known under various names such as Classic 40, Ruby 70, Topaz 70, Meteor 70, Acczent Excellence 80, Acczent Essential 70, and Aqua Multisafe. Specifically, the declared product is Topaz 70, with results based on a worst-case scenario. It is made from poly (vinyl chloride) and designed for a recommended service lifetime of 25 years.",The International EPD® System,,https://www.environdec.com/library/epd1348,,EPD,3,4,,,,吴宇森,,,,2024-07-30 16:17:59.056667,
11,1818425979434045440,76fc0cfd-1ac7-456e-8c51-457a39da93fc,"Aquarelle 墙面北欧风格, Aquarelle 墙面边框, Aquarelle 地板","Aquarelle Wall Nordics, Aquarelle Wall Border, Aquarelle Floor",m²,2024-07-09,2024-07-09,2029-07-09,Europe,,"Description: Tarkett, with over 130 years of experience, provides integrated solutions for floorings to professionals and end users. Its offerings include a wide range of designs, colors, and models, contributing to creating a positive environment and enhancing quality of life. Tarkett is committed to environmental sustainability, employing Cradle-to-Cradle principles in the design and production of its solutions. It actively participates in the Circular Economy 100 program, focusing on the reuse of materials and preservation of natural resources. The company's World Class Manufacturing (WCM) system emphasizes eliminating losses and improving process efficiency.

**Product Information:**
- **Aquarelle Wall Nordics:** Vinyl wall covering suitable for wet areas like collective showers, locker rooms, collective housing, and healthcare facilities.
- **Aquarelle Wall Border:** Vinyl wall covering complementing the Aquarelle Wall Nordics.
- **Aquarelle Floor:** Heterogeneous PVC floor covering, ideal for waterproof installations in domestic wet areas. Recommended service life is 20 years.",The International EPD® System,,https://www.environdec.com/library/epd15524,,EPD,3,4,,,,吴宇森,,,,2024-07-30 16:18:32.875170,
12,1818426226361110528,fed25541-7bfd-45a2-838d-216d94fc108a,Soprastick venti ff,SOPRASTICK VENTI FF,kg,2024-07-11,2024-07-11,2029-07-11,Worldwide,,"Description: Self-adhesive membrane with a vapour-pressure and tension dispersion system, composed of elastomer modified bitumen and a composite polyester reinforcement. Used as a base layer within a multi-layer waterproofing system on surfaces where partial adhesion is required. The upper surface is protected by a thermofusible film. The lower surface is provided with self-adhesive bitumen stripes alternated with non-stick stripes protected by a silicone release film. The overlap is partly self-adhesive (to prevent flame transmission) and partly torchable with flame or hot air. Energy consumption and used ancillary materials during installation are considered and are based on the average installation scenario of the product. The installation phase includes 10% overlapping material. The membrane has a reference service life of 70 YEARS, if combined with Soprema top layer.",The International EPD® System,,https://www.environdec.com/library/epd13740,,EPD,3,4,,,,吴宇森,,,,2024-07-30 16:19:31.747577,
13,1818426521367482368,691bf600-f010-466e-aa43-5dc328954ff2,ProtectWall 15、ProtectWall CR（无尘室）、Aquarelle Wall HFS,"ProtectWall 15, ProtectWall CR (Clean Rooms), Aquarelle Wall HFS",m²,2024-07-09,2024-07-09,2024-07-09,Europe,,"Description: Tarkett offers integrated solutions for floorings, able to meet the particular needs of customers. Their wide range of designs, colors, and models provides an infinite series of possibilities, contributing to creating a positive environment and a better quality of life for people. Tarkett operates with the utmost respect for the environment towards the realization of eco-friendly products. 

The company's commitment to the environment is woven throughout its business. Cradle-to-Cradle principles are, in fact, the basis of the design and production of every solution. Particularly, the lifecycle analysis is used to continuously improve the production process, and thus the products until their use stage, disposal, and recycling. 

The development of products that can be reused within internal production cycles, or external ones in case of other individuals, has been an integral part of the business strategy aimed at sustainability for many years. The WCM (World Class Manufacturing) management system has been developed in 2009, and it includes the environmental pillar aimed at the elimination of losses and growth of process efficiency.

**Product Information:**
- **Aquarelle Wall HFS:** A vinyl wall covering for use in wet areas such as collective showers, locker rooms, collective housing, and healthcare facilities.
- **ProtectWall 1.5 & ProtectWall CR (Clean Rooms):** High-performance vinyl wall coverings that protect walls against impacts, scratches, and stains.",The International EPD® System,,https://www.environdec.com/library/epd15522,,EPD,3,4,,,,吴宇森,,,,2024-07-30 16:20:42.082277,
14,1818426594319011840,c591cb19-eb6c-45e5-bff2-03902302552b,至尊高级乳液（35110），至尊高级乳液是一种采用 100 纯丙烯酸聚合物配制而成的优质产品，含有二氧化钛和其他高级耐光烷氧基苯乙烯颜料。,"Supreme Advanced Emulsion (35110), Supreme Advanced Emulsion is a premium product formulated using 100 Pure Acrylic polymer and containing titanium dioxide and other highgrade lightfast alkaliresisting pigments",m²,,,,Middle East,,"Description: Supreme Advanced Emulsion is a premium product formulated using 100% Pure Acrylic polymer and containing titanium dioxide and other high-grade light-fast alkali-resisting pigments. It is odourless and environmentally friendly. This emulsion has outstanding performance in the removal of common stains and shows excellent resistance to microbial growth, preventing the colonial growth of bacteria and keeping the coated surface hygienic.",The International EPD® System,,https://www.environdec.com/library/epd4631,,EPD,3,4,,,,吴宇森,,,,2024-07-30 16:20:59.475919,
15,1818427513223909376,21dccd72-5f4d-400f-bde3-7ec0b9aa7be2,C35/45，XC3，S4，砾石（35C34G1000322），C35/45，XC3，S4，砾石（35C34G1000323）,"C35/45, XC3, S4, Gravel (35C34G1000322), C35/45, XC3, S4, Gravel (35C34G1000323)",m,2024-07-25,2024-07-25,2029-07-24,Greece,,"Description: Concrete is a material formed by mixing cement, coarse and fine aggregate and water, with or without the incorporation of admixtures and additions. Fresh concrete is manufactured at ready-mix batch plants and is delivered to the construction sites in a liquid state. Fresh concrete is placed, compacted and hardened in the desired shape, via a chemical reaction: the hydration of cement. The cement is the binding agent in concrete: it is a finely ground powder that when hydrated forms a paste that sets, hardens, and adheres to other materials and after hardening retains its strength even underwater. It is used as the main raw material in the production of concrete, mortar, grouts, and plasters. This concrete mix is compliant with the requirements of ELOT EN 206 and the Concrete Technology Regulation KTS 2016, and is produced by Interbeton Building Materials S.A. These specific types of concrete have a wide range of applications and are mainly utilized in civil engineering works and in residential and commercial construction. The product is delivered in bulk with ready-mix trucks.",The International EPD® System,,https://www.environdec.com/library/epd15529,,EPD,3,4,,,,吴宇森,,,,2024-07-30 16:24:38.559222,
16,1818427728370733056,cb9f90ab-3060-4879-a0d3-1b39e7d505ca,"Getacore 超薄台面（G86）（16 毫米）, Getacore 超薄台面（G33）（25 毫米）","Getacore Worktops(G86)  Thin Version(16mm), Getacore Worktops(G33)  Thin Version(25mm)",m²,2022-07-19,2022-07-19,2027-07-18,,,"Description: The thin Getacore® worktop is a composite element consisting of acrylic bonded Getacore® Smart sheet, chipboard substrate, Getalit® HPL (high-pressure laminate), and agglutinates compounds. It is available in two different thicknesses (16mm and 25mm) and features a 10mm front edge of Getacore® material. The product is faced with Getacore® Smart sheet (3mm) and the reverse side is balanced with Getalit® HPL (0.7mm). The worktop is glued with quality D3 adhesive according to EN 204/205. Notable for its elegance and style, it also offers practical benefits such as easy removal of scratches and signs of use through sanding, allowing for renovation back to its original condition. Getacore® is safe for contact with food, durable, easy to clean and repair, non-porous, and allows for seamless joints. Additionally, it is easy to process and offers superior color consistency due to its Made-in-Germany production process.",The International EPD® System,,https://www.environdec.com/library/epd6400,,EPD,3,4,,,,吴宇森,,,,2024-07-30 16:25:29.854357,
